Symbol,Name,Market
LDP,Cong ty Co phan Duoc Lam Dong - Ladophar,HNX
LDW,Cong ty co phan Cap thoat nuoc Lam Dong,Upcom
LEC,Cong ty Co phan Bat dong san Dien luc Mien Trung,HSX
LG9,Cong ty Co phan Co gioi va Xay lap so 9,Upcom
LGC,Cong ty Co phan Dau tu Cau duong CII,HSX
LGL,Cong ty co phan Dau tu va Phat trien Do thi Long Giang,HSX
LGM,CTCP Giay da va May mac Xuat khau (LEGAMEX),Upcom
LHC,Cong ty Co phan Dau tu va Xay dung Thuy loi Lam Dong,HNX
LHG,Cong ty Co phan Long Hau,HSX
LIC,Tong Cong ty Licogi - Cong ty Co phan,Upcom
LIG,Cong ty Co phan Licogi 13,HNX
LIONGVF,LionGlobal Vietnam Fund,OTC
LIX,Cong ty Co phan Bot giat Lix,HSX
LKW,CTCP Cap nuoc Long Khanh,Upcom
LLM,Tong Cong ty Lap may Viet Nam - CTCP,Upcom
LM3,Cong ty Co phan Lilama 3,Upcom
LM7,Cong ty Co phan Lilama 7,HNX
LM8,Cong ty Co phan Lilama 18,HSX
LMC,Cong ty Co phan Khoang san Latca,Upcom
LMH,Cong ty Co phan Landmark Holding,Upcom
LMI,Cong ty Co phan Dau tu Xay dung Lap may IDICO,Upcom
LNC,Cong ty co phan Le Ninh,Upcom
LNS,Cong ty co phan Mia duong La Nga,OTC
LO5,Cong ty Co phan Lilama 5,HNX
LONGHAIGROUP,Cong ty CP Tap doan dau tu Long Hai,OTC
LONGTHANHPLASTIC,Cong ty TNHH Nhua Long Thanh,OTC
LPB,Ngan hang TMCP Buu dien Lien Viet,HSX
LQN,Cong ty co phan Licogi Quang Ngai,Upcom
LSS,Cong ty Co phan Mia duong Lam Son,HSX
LTC,Cong ty co phan Dien nhe Vien thong,Upcom
LTG,Cong ty Co phan Tap doan Loc Troi,Upcom
LUCKYTEL,Cong ty CP XNK thiet bi vien thong May Man,OTC
LUNGLO,Tong Cong ty Xay dung Lung Lo,OTC
LUT,Cong ty Co phan Dau tu Xay dung Luong Tai,HNX
LVS,Cong ty co phan Chung khoan Lien Viet,OTC
LWS,Cong ty Co phan Cap nuoc tinh Lao Cai,Upcom
M10,Tong Cong ty May 10 - CTCP,Upcom
MA1,Cong ty co phan Thiet bi,Upcom
MAC,Cong ty Co phan Cung ung va Dich vu Ky thuat Hang Hai,HNX
MAFPF1,Quy dau tu tang truong Manulife,HSX
MANULIFE,Cong ty TNHH Manulife (Viet Nam),OTC
MAS,Cong ty co phan Dich vu Hang khong San bay Da Nang,HNX
MAX,Cong ty Co phan Khai khoang va Co khi Huu nghi Vinh Sinh,HNX
MBB,Ngan hang Thuong mai Co phan Quan doi,HSX
MBG,Cong ty co phan Tap doan MBG,HNX
MBKE,Cong ty co phan Chung khoan MayBank Kim Eng,OTC
MBN,Cong ty co phan Moi truong va Cong trinh Do thi Bac Ninh,Upcom
MBS,Cong ty co phan Chung khoan MB,HNX
MC3,Cong ty Co phan Khoang san 3 - Vimico,Upcom
MCC,Cong ty Co phan Gach ngoi cao cap,HNX
MCF,CTCP Xay lap Co khi va Luong thuc Thuc pham,HNX
MCG,Cong ty Co phan Co dien va Xay dung Viet Nam,HSX
MCH,Cong ty Co phan Hang tieu dung Masan,Upcom
MCI,CTCP Dau tu Xay dung va Phat trien Vat lieu IDICO,Upcom
MCK,'',Upcom
MCL,Cong ty Co phan Phat trien Nha va San xuat Vat lieu xay dung Chi Linh,HNX
MCO,Cong ty Co phan Dau tu va Xay dung BDC Viet Nam,HNX
MCP,Cong ty co phan In va Bao bi My Chau,HSX
MCT,Cong ty Co phan Kinh doanh Vat tu va Xay dung,Upcom
MCV,Cong ty Co phan Cavico Viet Nam Khai thac Mo va Xay dung,HSX
MDA,Cong ty Co phan Moi truong Do thi Dong Anh,Upcom
MDC,Cong ty co phan Than Mong Duong - Vinacomin,HNX
MDF,Cong ty co phan Go MDF VRG Quang Tri,Upcom
MDG,Cong ty Co phan mien Dong,HSX
MDN,CTCP Tong Cong ty May Dong Nai,Upcom
MDT,CTCP Co khi mo va Dong tau - TKV,Upcom
MEC,Cong ty Co phan Co khi - lap may Song Da,Upcom
MED,Cong ty co phan Duoc Trung uong Mediplantex,HNX
MEDIAMART,CTCP Mediamart Viet Nam,OTC
MEF,Cong ty co phan MEINFA,Upcom
MEG,Cong ty co phan Megram,Upcom
MEKONGCAP,Mekong Capital,OTC
MEL,Cong ty Co phan Thep Me Lin,HNX
MERCEDESVN,Cong ty Lien doanh Mercedes-Benz Viet Nam,OTC
MES,Cong ty co phan Co dien Cong trinh,Upcom
METROVN,Cong ty TNHH Metro Cash & Carry Viet Nam,OTC
MFS,Cong ty Co phan Dich vu Ky thuat Mobifone,Upcom
MGC,CTCP Dia chat mo - TKV,Upcom
MGG,Tong Cong ty Duc Giang - Cong ty Co phan,Upcom
MH3,Cong ty Co phan Khu cong nghiep Cao Su Binh Long,Upcom
MHB,Ngan hang TMCP Phat trien nha dong bang song Cuu Long,OTC
MHBS,Cong ty co phan Chung khoan Ngan hang Phat trien Nha dong bang Song Cuu Long,OTC
MHC,Cong ty Co phan MHC,HSX
MHDI,Tong Cong ty Dau tu phat trien nha va Do thi - BQP,OTC
MHL,Cong ty Co phan Minh Huu Lien,HNX
MHP,CTCP Moi truong va Dich vu do thi Viet Tri,Upcom
MHY,Cong ty TNHH MTV Moi truong va Cong trinh Do thi Hung Yen,Upcom
MIC,Cong ty Co phan Ky nghe Khoang san Quang Nam,Upcom
MICROSOFT,Cong ty TNHH Microsoft Viet Nam,OTC
MIE,Tong Cong ty May va Thiet bi Cong nghiep - CTCP,Upcom
MIG,Tong Cong ty co phan Bao hiem Quan doi,Upcom
MIH,Cong ty Co phan Xuat nhap khau Khoang san Ha Nam,HNX
MIM,Cong ty Co phan Khoang san va Co khi,HNX
MINHLONG1,Cong ty TNHH Minh Long 1,OTC
MINHVIETCAPITAL,Cong ty Co phan Quan ly quy dau tu Chung khoan Minh Viet,OTC
MIPEC,CTCP Hoa dau Quan doi,OTC
MIPECORP,Tong Cong ty Xang dau Quan doi,OTC
MIRAEASSET,Cong ty TNHH Chung khoan Mirae Asset (Viet Nam),OTC
MJC,Cong ty Co phan Thuong mai Moc Hoa,Upcom
MKP,Cong ty Co phan Hoa - Duoc pham Mekophar,Upcom
MKT,Cong ty co phan Det Minh Khai,Upcom
MKV,Cong ty Co phan Duoc Thu y Cai Lay,HNX
MLC,Cong ty Co phan Moi truong Do thi Tinh Lao Cai,Upcom
MLG,Cong ty Co phan Tap doan Mai Linh,OTC
MLN,Cong ty co phan Mai Linh Mien Bac,Upcom
MLS,Cong ty co phan Chan nuoi - Mitraco,Upcom
MMC,Cong ty Co phan Khoang san Mangan,Upcom
MML,Cong ty Co phan Masan MEATLife,Upcom
MNB,Tong Cong ty May Nha Be - Cong ty Co phan,Upcom
MNC,Cong ty Co phan Tap doan Mai Linh Mien Trung,HNX
MND,Cong ty Co phan Moi truong Nam Dinh,Upcom
MOBIFONE,Tong Cong ty Vien thong Mobifone,OTC
MOCCHAUMILK,CTCP Giong bo sua Moc Chau,OTC
MOMOTA,Cong ty co phan 118,OTC
MPC,Cong ty Co phan Tap doan Thuy san Minh Phu,Upcom
MPHG,CTCP Che bien Thuy san Minh Phu - Hau Giang,OTC
MPT,Cong ty co phan Tap doan Truong Tien,HNX
MPY,Cong ty Co phan Moi truong Do thi Phu Yen,Upcom
MQB,Cong ty Co phan Moi truong va phat trien Do thi Quang Binh,Upcom
MQN,Cong ty Co phan Moi truong do thi Quang Ngai,Upcom
MRF,Cong ty co phan Merufa,Upcom
MSC,Cong ty co phan Dich vu Phu Nhuan,HNX
MSG,Cong ty Co phan Chung khoan MORGAN STANLEY Huong Viet,OTC
MSH,Cong ty co phan May Song Hong,HSX
MSI,Cong ty Co phan Chung khoan KB Viet Nam,OTC
MSM,Cong ty TNHH Truyen thong Megastar,OTC
MSN,Cong ty Co phan Tap doan MaSan,HSX
MSR,Cong ty co phan Masan High-Tech Materials,Upcom
MST,Cong ty Co phan Dau tu MST,HNX
MTA,Tong Cong ty Khoang san va Thuong mai Ha Tinh - CTCP,Upcom
MTC,CTCP Dich vu Du lich My Tra,Upcom
MTG,Cong ty Co phan MT Gas,Upcom
MTH,Cong ty Co phan Moi truong Do thi Ha Dong,Upcom
MTL,CTCP Dich vu Moi truong Do thi Tu Liem,Upcom
MTM,CTCP Mo va Xuat nhap khau Khoang san Mien Trung,Upcom
MTP,Cong ty Co phan Duoc Medipharco,Upcom
MTS,Cong ty co phan Vat tu - TKV,Upcom
MTV,Cong ty Co phan Dich vu Moi truong va Cong trinh Do thi Vung Tau,Upcom
MUONGTHANH,Doanh nghiep tu nhan Xay dung so 1 tinh Dien Bien,OTC
MVB,Tong cong ty Cong nghiep mo Viet Bac TKV - CTCP,HNX
MVC,Cong ty Co phan Vat lieu va Xay dung Binh Duong,Upcom
MVN,Tong Cong ty Hang hai Viet Nam - CTCP,Upcom
MVY,Cong ty Co phan Moi truong va Dich vu Do thi Vinh Yen,Upcom
MWG,Cong ty co phan Dau tu The gioi Di dong,HSX
NAB,Ngan hang TMCP Nam A,Upcom
NAC,Cong ty Co phan Tu van Xay dung Tong hop,Upcom
NAF,Cong ty Co phan Nafoods Group,HSX
NAG,Cong ty co phan Tap doan Nagakawa,HNX
NAKYDACO,CTCP Dau thuc vat Tan Binh,OTC
NAMCUONG,CTCP Tap doan Nam Cuong Ha Noi,OTC
NAP,Cong ty co phan Cang Nghe Tinh,HNX
NAS,Cong ty Co phan Dich vu Hang khong San bay Noi Bai,Upcom
NASC,Cong ty TNHH Chung khoan Shinhan Viet Nam,OTC
NASICO,Cong ty TNHH MTV Dong Tau Nam Trieu,OTC
NAU,Cong ty co phan Moi truong va Cong trinh do thi Nghe An,Upcom
NAV,Cong ty Co phan Nam Viet,HSX
NAW,Cong ty Co phan Cap nuoc Nghe An,Upcom
NBB,Cong ty Co phan Dau tu Nam Bay Bay,HSX
NBC,Cong ty co phan Than Nui Beo – Vinacomin,HNX
NBE,Cong ty Co phan Sach va Thiet bi Giao duc Mien Bac,Upcom
NBP,Cong ty Co phan Nhiet dien Ninh Binh,HNX
NBR,CTCP Duong sat Nghia Binh,Upcom
NBS,Cong ty Co phan Ben xe Nghe An,Upcom
NBT,CTCP Cap thoat nuoc Ben Tre,Upcom
NBW,Cong ty Co phan Cap nuoc Nha Be,HNX
NCP,Cong ty Co phan Nhiet dien Cam Pha - TKV,Upcom
NCS,Cong ty co phan Suat an Hang khong Noi Bai,Upcom
NCT,Cong ty Co phan Dich vu Hang hoa Noi Bai,HSX
ND2,Cong ty Co phan Dau tu Phat trien dien Mien Bac 2,Upcom
NDC,Cong ty Co phan Nam Duoc,Upcom
NDF,CTCP Che bien thuc pham nong san xuat khau Nam Dinh,Upcom
NDHI,Cong ty TNHH Dau tu NDH Viet Nam,OTC
NDHINVEST,Cong ty TNHH Dau tu NDH,OTC
NDN,Cong ty Co phan Dau tu Phat trien Nha Da Nang,HNX
NDP,Cong ty Co phan Duoc pham 2/9,Upcom
NDT,Tong Cong ty co phan Det may Nam Dinh,Upcom
NDW,CTCP Cap nuoc Nam Dinh,Upcom
NDX,Cong ty Co phan Xay lap Phat trien Nha Da Nang,HNX
NECORP,Tong Cong ty Dong Bac - BQP,OTC
NED,Cong ty co phan Dau tu va Phat trien Dien Tay Bac,Upcom
NET,Cong ty Co phan Bot giat Net,HNX
NFC,Cong ty Co phan Phan lan Ninh Binh,HNX
NGC,Cong ty Co phan Che bien Thuy san Xuat khau Ngo Quyen,HNX
NGUYENKIM,CTCP Thuong mai Nguyen Kim,OTC
NHA,Tong Cong ty Dau tu Phat trien Nha va Do thi Nam Ha Noi,HNX
NHAC,Cong ty Co Phan Nguyen Ha A Chau,OTC
NHC,Cong ty Co phan Gach Ngoi Nhi Hiep,HNX
NHH,Cong ty Co phan Nhua Ha Noi,HSX
NHN,Cong ty co phan Phat trien do thi Nam Ha Noi,Upcom
NHONHOA,Cong ty TNHH San xuat can Nhon Hoa,OTC
NHP,Cong ty Co phan San xuat Xuat nhap khau NHP,HNX
NHS,Cong ty Co phan Duong Ninh Hoa,HSX
NHT,Cong ty Co phan San xuat va Thuong mai Nam Hoa,Upcom
NHV,Cong ty co phan Dau tu NHV,Upcom
NHW,Cong ty Co phan Ngo Han,HSX
NIS,Cong ty Co phan Dich vu Ha tang mang,HNX
NISACO,Cong ty co phan Muoi Ninh Thuan,OTC
NJC,Cong ty co phan May Nam Dinh,Upcom
NKD,Cong ty Co phan Che bien Thuc pham Kinh Do Mien Bac,HSX
NKG,Cong ty Co phan Thep Nam Kim,HSX
NKID,CTCP Dau tu va Phat trien Nguyen Kim,OTC
NLC,Cong ty Co phan Thuy dien Na Loi,HNX
NLG,Cong ty co phan Dau tu Nam Long,HSX
NLS,Cong ty co phan Cap thoat Nuoc Lang Son,Upcom
NMK,Cong ty co phan Xay dung Cong trinh 510,Upcom
NNB,CTCP Cap thoat nuoc Ninh Binh,Upcom
NNC,Cong ty Co phan Da Nui Nho,HSX
NNG,Cong ty Co phan Cong nghiep - Dich vu - Thuong Mai Ngoc Nghia,Upcom
NNQ,Trung tam Giong Nong - Lam nghiep Quang Nam,Upcom
NNT,Cong ty co phan Cap nuoc Ninh Thuan,Upcom
NORCEM,CTCP Kinh doanh Xi mang Mien Bac,OTC
NOS,Cong ty Co phan Van tai bien va Thuong mai Phuong Dong,Upcom
NPH,CTCP Khach san Buu dien Nha Trang,Upcom
NPS,Cong ty Co phan May Phu Thinh - Nha Be,Upcom
NQB,Cong ty co phan Cap nuoc Quang Binh,Upcom
NQN,Cong ty Co phan Nuoc sach Quang Ninh,Upcom
NQT,Cong ty Co phan Nuoc sach Quang Tri,Upcom
NRC,Cong ty Co phan Bat dong san Netland,HNX
NS2,Cong ty Co phan Nuoc sach so 2 Ha Noi,Upcom
NS3,CTCP San xuat Kinh doanh Nuoc sach so 3 Ha Noi,Upcom
NSC,Cong ty co phan Tap doan Giong cay trong Viet Nam,HSX
NSG,CTCP Nhua Sai Gon,Upcom
NSH,Cong ty Co phan Nhom Song Hong,HNX
NSI,Cong ty Co phan Chung khoan Quoc gia,OTC
NSL,Cong ty co phan Cap nuoc Son La,Upcom
NSN,Cong ty Co phan Xay dung 565,HNX
NSP,Cong ty Co phan Nhua Sam Phu,Upcom
NSS,Cong ty co phan Nong Suc San Dong Nai,Upcom
NST,Cong ty Co phan Ngan Son,HNX
NT2,Cong ty Co phan Dien luc Dau khi Nhon Trach 2,HSX
NTB,Cong ty co phan Dau tu Xay dung va Khai thac Cong trinh Giao thong 584,Upcom
NTC,Cong ty Co phan Khu Cong nghiep Nam Tan Uyen,Upcom
NTF,CTCP Duoc - Vat tu Y te Nghe An,Upcom
NTH,Cong ty Co phan thuy dien Nuoc Trong,HNX
NTL,Cong ty Co phan Phat trien Do thi Tu Liem,HSX
NTP,Cong ty Co phan Nhua Thieu nien Tien Phong,HNX
NTR,Cong ty Co Phan Duong sat Nghe Tinh,Upcom
NTSF,Cong ty Co phan Nha Trang Seafoods - F17,OTC
NTT,Cong ty Co phan Det - May Nha Trang,Upcom
NTW,Cong ty co phan Cap nuoc Nhon Trach,Upcom
NUE,Cong ty Co phan Moi truong Do thi Nha Trang,Upcom
NVB,Ngan hang Thuong mai co phan Quoc Dan,HNX
NVC,Cong ty Co phan Nam Vang,HNX
NVL,Cong ty co phan Tap doan Dau tu Dia oc No Va,HSX
NVN,Cong ty Co phan Nha Viet Nam,HSX
NVP,Cong ty Co phan Nuoc sach Vinh Phuc,Upcom
NVS,Cong ty co phan Chung khoan NAVIBANK,OTC
NVT,Cong ty Co phan Bat dong san Du lich Ninh Van Bay,HSX
NWT,CTCP Van tai Newway,Upcom
OCB,Ngan hang Thuong mai co phan Phuong Dong,OTC
OCH,Cong ty Co phan Khach san va Dich vu OCH,HNX
OCS,Cong ty Co phan Chung khoan Dai Duong,OTC
OGC,Cong ty Co phan Tap doan Dai Duong,HSX
OIL,Tong Cong ty Dau Viet Nam - CTCP,Upcom
OLAM,Cong ty TNHH Olam Viet Nam,OTC
OLC,"Cong ty co phan Xay dung, Dich vu va Hop tac lao dong",Upcom
OMC,Cong ty Co phan Quan ly quy dau tu Chung khoan Phuong Dong,OTC
ONE,Cong ty Co phan Truyen thong so 1,HNX
ONW,Cong ty Co phan Dich vu Mot The gioi,Upcom
OPC,Cong ty co phan Duoc pham OPC,HSX
ORION,Cong ty TNHH Thuc pham Orion Vina,OTC
ORS,Cong ty Co phan Chung khoan Tien Phong,Upcom
OSC,Cong ty Co phan Chung khoan DAI TAY DUONG,OTC
OSCVN,CTCP Du lich Dich vu Dau khi Viet Nam,OTC
OTG,CTCP Otran Logistics,OTC
OTRAN,CTCP Otran Viet Nam,OTC
PAC,Cong ty Co phan Pin Ac quy Mien Nam,HSX
PAI,"CTCP Cong nghe thong tin, vien thong va tu dong hoa Dau khi",Upcom
PAN,Cong ty Co phan Tap doan PAN,HSX
PAP,CTCP Dau khi dau tu khai thac Cang Phuoc An,OTC
PARKSON,Cong ty TNHH Parkson Viet Nam,OTC
PAS,Cong ty co phan Quoc te Phuong Anh,Upcom
PBC,CTCP Duoc pham Trung uong I - Pharbaco,Upcom
PBK,Cong ty co phan Dien luc Dau khi Bac Kan,Upcom
PBP,Cong ty co phan Bao bi Dau khi Viet Nam,HNX
PBT,Cong ty co phan Nha va Thuong mai Dau khi,Upcom
PC1,Cong ty co phan Xay lap dien 1,HSX
PCC,Cong ty Co phan Tap doan Xay lap 1 - Petrolimex,Upcom
PCE,Cong ty co phan Phan bon va Hoa chat Dau khi Mien Trung,HNX
PCF,Cong ty co phan Ca Phe Petec,Upcom
PCG,Cong ty Co phan Dau tu va Phat trien Gas Do Thi,HNX
PCM,Cong ty Co phan Vat lieu Xay dung Buu dien,Upcom
PCN,Cong ty co phan Hoa pham dau khi DMC - mien Bac,Upcom
PCT,Cong ty co phan Van tai khi va hoa chat Viet Nam,HNX
PDB,Cong ty Co phan Vat lieu xay dung Dufago,HNX
PDC,Cong ty co phan Du lich Dau khi Phuong Dong,HNX
PDN,Cong ty Co phan Cang Dong Nai,HSX
PDR,Cong ty co phan Phat trien Bat dong san Phat Dat,HSX
PDT,Cong ty TNHH MTV Thuong mai Dau khi Dong Thap,Upcom
PDV,Cong ty co phan Van tai dau Phuong Dong Viet,Upcom
PEC,Cong ty Co phan Co khi Dien luc,Upcom
PEG,Tong Cong ty Thuong mai Ky thuat va Dau tu - CTCP,Upcom
PEN,Cong ty co phan Xay lap III Petrolimex,HNX
PENM,BankInvest/PENM Partners,OTC
PEQ,Cong ty co phan Thiet bi Xang dau Petrolimex,Upcom
PET,Tong Cong ty Co phan Dich vu Tong hop Dau khi,HSX
PFI,Cong ty Co phan Dau tu Tai chinh Cong doan Dau khi,OTC
PFL,Cong ty co phan Dau khi Dong Do,Upcom
PFV,Cong ty Co phan Dau tu va Thuong mai PFV,Upcom
PGC,Tong Cong ty Gas Petrolimex-CTCP,HSX
PGD,Cong ty Co phan Phan phoi Khi thap ap Dau khi Viet Nam,HSX
PGI,Tong Cong ty co phan Bao hiem Petrolimex,HSX
PGN,Cong ty Co phan Phu gia Nhua,HNX
PGS,Cong ty Co phan Kinh doanh Khi Mien Nam,HNX
PGSC,Cong ty Co phan Chung khoan PHU GIA,OTC
PGT,Cong ty Co phan PGT Holdings,HNX
PGV,Tong Cong ty Phat dien 3 - Cong ty co phan,Upcom
PHC,Cong ty co phan Xay dung Phuc Hung Holdings,HSX
PHH,Cong ty Co phan Hong Ha Viet Nam,Upcom
PHN,Cong ty Co phan Pin Ha Noi,HNX
PHP,Cong ty co phan Cang Hai Phong,HNX
PHR,Cong ty co phan Cao su Phuoc Hoa,HSX
PHS,Cong ty Co phan Chung khoan Phu Hung,Upcom
PHT,Cong ty Co phan San xuat va Thuong mai Phuc Tien,HSX
PHUCSINH,CTCP Ca phe Phuc Sinh,OTC
PHUMYHUNG,Cong ty TNHH Phat trien Phu My Hung,OTC
PIA,Cong ty co phan Tin hoc Vien thong Petrolimex,HNX
PIAGGIO,Cong ty TNHH Piaggio Viet Nam,OTC
PIC,Cong ty co phan Dau tu Dien luc 3,HNX
PICO,CTCP PICO,OTC
PID,Cong ty Co phan Trang tri Noi that Dau khi,Upcom
PIS,Tong Cong ty Pisico Binh Dinh - CTCP,Upcom
PIT,Cong ty Co phan Xuat nhap khau Petrolimex,HSX
PIV,Cong ty Co phan PIV,Upcom
PIVLS,Cong ty Co phan Dau tu Khu cong nghiep Dau khi - Idico Long Son,OTC
PJC,Cong ty Co phan Thuong mai va Van tai Petrolimex Ha Noi,HNX
PJS,Cong ty co phan Cap nuoc Phu Hoa Tan,Upcom
PJT,Cong ty Co phan Van tai Xang dau Duong thuy Petrolimex,HSX
PKR,Cong ty Co phan Duong sat Phu Khanh,Upcom
PLA,Cong ty co phan Dau tu Dich vu Ha tang Xang Dau,Upcom
PLASCHEM,CTCP Hoa chat nhua,OTC
PLC,Tong Cong ty Hoa dau Petrolimex-CTCP,HNX
PLO,Cong ty Co phan Kho Van Petec,Upcom
PLP,Cong ty Co phan San xuat va Cong nghe Nhua Pha Le,HSX
PLX,Tap doan Xang dau Viet Nam,HSX
PMB,Cong ty co phan Phan bon va Hoa chat Dau khi Mien Bac,HNX
PMC,Cong ty Co phan Duoc pham Duoc lieu Pharmedic,HNX
PME,Cong ty Co phan Pymepharco,HSX
PMG,Cong ty Co phan Dau tu va San xuat Petro Mien Trung,HSX
PMJ,Cong ty co phan Vat tu Buu dien,Upcom
PMP,Cong ty co phan Bao bi Dam Phu My,HNX
PMS,Cong ty Co phan Co khi Xang dau,HNX
PMT,Cong ty co phan Vien thong TELVINA Viet Nam,Upcom
PMW,Cong ty co phan Cap nuoc Phu My,Upcom
PNC,Cong ty Co phan Van hoa Phuong Nam,HSX
PND,Cong ty Co phan Xang dau Dau khi Nam Dinh,Upcom
PNG,Cong ty co phan Thuong mai Phu Nhuan,Upcom
PNJ,Cong ty Co phan Vang bac Da quy Phu Nhuan,HSX
PNP,Cong ty co phan Tan Cang - Phu Huu,Upcom
PNT,Cong ty co phan Ky thuat Xay dung Phu Nhuan,Upcom
POB,Cong ty Co phan Xang dau Dau khi Thai Binh,Upcom
POM,Cong ty Co phan Thep Pomina,HSX
POS,"Cong ty Co phan Dich vu Lap dat, Van hanh va Bao duong Cong trinh Dau khi bien PTSC",Upcom
POT,Cong ty Co phan Thiet bi Buu dien,HNX
POV,Cong ty Co phan Xang dau Dau khi Vung Ang,Upcom
POW,Tong Cong ty Dien luc Dau khi Viet Nam - CTCP,HSX
PPC,Cong ty Co phan Nhiet dien Pha Lai,HSX
PPE,Cong ty co phan Tu van Dien luc Dau khi Viet Nam,HNX
PPG,Cong ty co phan San xuat Thuong mai Dich vu Phu Phong,Upcom
PPH,Tong Cong ty Co phan Phong Phu,Upcom
PPI,Cong ty Co phan Dau tu va Phat trien Du an Ha tang Thai Binh Duong,Upcom
PPP,Cong ty Co phan Duoc pham Phong Phu,HNX
PPS,Cong ty Co phan Dich vu Ky thuat Dien luc Dau khi Viet Nam,HNX
PPY,CTCP Xang dau Dau khi Phu Yen,HNX
PQG,CTCP Dau tu vang Phu Quy,OTC
PQN,CTCP Dich vu Dau khi Quang Ngai PTSC,Upcom
PRC,Cong ty Co phan Logistics Portserco,HNX
PRE,Cong ty Tai bao hiem PVI,HNX
PRIME,CTCP Prime Group,OTC
PRO,Cong ty Co phan Procimex Viet Nam,Upcom
PROCONCO,CTCP Viet Phap san xuat thuc an gia suc,OTC
PRT,Tong cong ty San xuat - Xuat nhap khau Binh Duong - TNHH MTV,Upcom
PRUBF1,Quy Dau tu Can bang Prudential,HSX
PRUDENTIAL,Cong ty TNHH Bao hiem Nhan tho Prudential Viet Nam,OTC
PRUFC,Cong ty TNHH MTV Tai chinh Prudential Viet Nam,OTC
PSB,Cong ty co phan Dau tu Dau khi Sao Mai – Ben Dinh,Upcom
PSC,Cong ty co phan Van tai va Dich vu Petrolimex Sai Gon,HNX
PSD,Cong ty co phan Dich vu Phan phoi Tong hop Dau khi,HNX
PSE,Cong ty co phan Phan bon va Hoa chat Dau khi Dong Nam Bo,HNX
PSG,Cong ty Co phan Dau tu va Xay lap Dau khi Sai Gon,Upcom
PSH,CTCP Thuong mai Dau tu Dau khi Nam Song Hau,HSX
PSI,Cong ty co phan Chung khoan Dau khi,HNX
PSL,Cong ty Co phan Chan nuoi Phu Son,Upcom
PSN,Cong ty Co phan Cang dich vu Dau khi Tong hop PTSC Thanh Hoa,Upcom
PSP,Cong ty Co phan Cang dich vu Dau khi Dinh Vu,Upcom
PSW,Cong ty co phan Phan bon va Hoa chat Dau khi Tay Nam Bo,HNX
PTB,Cong ty Co phan Phu Tai,HSX
PTC,Cong ty Co phan Dau tu va Xay dung Buu dien,HSX
PTD,CTCP Thiet ke - Xay dung - Thuong mai Phuc Thinh,HNX
PTE,Cong ty Co phan Xi mang Phu Tho,Upcom
PTG,Cong ty Co phan May Xuat khau Phan Thiet,Upcom
PTH,Cong ty Co phan Van tai va Dich vu Petrolimex Ha Tay,Upcom
PTI,Tong Cong ty Co phan Bao hiem Buu dien,HNX
PTK,Cong ty Co phan Luyen kim Phu Thinh,Upcom
PTL,Cong ty Co phan Dau tu Ha tang va Do thi Dau khi,HSX
PTM,"Cong ty co phan San xuat, Thuong mai va Dich vu oto PTM",Upcom
PTO,Cong ty Co phan Dich vu - Xay dung Cong trinh Buu dien,Upcom
PTP,Cong ty Co phan Dich vu Vien thong va In Buu dien,Upcom
PTS,Cong ty Co phan Van tai va Dich vu Petrolimex Hai Phong,HNX
PTT,Cong ty Co phan Van tai Dau khi Dong Duong,Upcom
PTV,Cong ty co phan Thuong mai Dau khi,Upcom
PTX,Cong ty co phan Van tai va Dich vu Petrolimex Nghe Tinh,Upcom
PV2,Cong ty co phan Dau tu PV2,HNX
PVA,Cong ty Co phan Tong Cong ty Xay lap Dau khi Nghe An,Upcom
PVB,Cong ty co phan Boc ong Dau khi Viet Nam,HNX
PVC,Tong Cong ty Hoa chat va Dich vu Dau khi - CTCP,HNX
PVCME,Cong ty co phan Thi cong co gioi va lap may dau khi,OTC
PVD,Tong Cong ty Co phan Khoan va Dich vu Khoan Dau khi,HSX
PVE,Tong Cong ty Tu van Thiet ke Dau khi-CTCP,Upcom
PVEIC,Tong Cong ty Bao Duong -Sua chua Cong trinh Dau khi - CTCP,OTC
PVEP,Tong Cong ty Tham do Khai thac Dau khi,OTC
PVF,Tong Cong ty Tai chinh Co phan Dau khi Viet Nam,HSX
PVFCC,Cong ty Co phan Quan ly quy Dau tu Tai chinh Dau khi,OTC
PVG,Cong ty Co phan Kinh doanh LPG Viet Nam,HNX
PVH,Cong ty co phan Xay lap dau khi Thanh Hoa,Upcom
PVI,Cong ty Co phan PVI,HNX
PVID,Cong ty co phan Dau tu va Xay lap khi,OTC
PVIF,Cong ty co phan Dau tu Tai chinh Bao hiem Dau khi,OTC
PVIINSURANCE,Tong Cong ty Bao hiem PVI,OTC
PVL,Cong ty co phan Dau tu Nha dat Viet,HNX
PVM,Cong ty Co phan May - Thiet bi Dau khi,Upcom
PVN,Tap doan Dau khi Viet Nam,OTC
PVO,CTCP Dau nhon PV Oil,Upcom
PVP,Cong ty Co phan Van tai dau khi Thai Binh Duong,Upcom
PVR,Cong ty Co phan dau tu PVR Ha Noi,Upcom
PVS,Tong Cong ty Co phan Dich vu Ky thuat Dau khi Viet Nam,HNX
PVSH,Cong ty co phan Dau tu va Thuong mai Dau khi Song Hong,OTC
PVST,Cong ty co phan Du lich dau khi Sapa,OTC
PVT,Tong cong ty Co phan Van tai Dau khi,HSX
PVV,Cong ty Co phan Vinaconex 39,Upcom
PVX,Tong Cong ty co phan Xay lap Dau khi Viet Nam,Upcom
PVY,Cong ty Co phan Che tao Gian khoan Dau khi,Upcom
PWA,Cong ty Co phan Bat dong san Dau khi,Upcom
PWS,Cong ty Co phan Cap thoat nuoc Phu Yen,Upcom
PX1,Cong ty co phan Xi mang Song Lam 2,Upcom
PXA,Cong ty co phan Dau tu & Thuong mai Dau khi Nghe An,Upcom
PXC,Cong ty co phan Phat trien do thi Dau khi,Upcom
PXH,Cong ty co phan Xay lap Dau khi Ha Noi,OTC
PXI,Cong ty Co phan Xay dung cong nghiep va dan dung Dau khi,HSX
PXL,Tong Cong ty co phan Dau tu va Phat trien KCN Dau khi-Long Son,Upcom
PXM,Cong ty Co phan Xay lap Dau khi Mien Trung,Upcom
PXPVEEF,PXP Vietnam Emerging Equity Fund,OTC
PXS,Cong ty Co phan Ket cau Kim loai va Lap may Dau khi,HSX
PXT,Cong ty Co phan Xay lap Duong ong Be chua Dau khi,HSX
PYNMFE,Mutual Fund Elite,OTC
PYU,Cong ty Co phan Moi truong va Cong trinh Do thi Phuc Yen,Upcom
QBR,Cong ty Co Phan Duong sat Quang Binh,Upcom
QBS,Cong ty Co phan Xuat nhap khau Quang Binh,HSX
QCC,CTCP Dau tu Xay dung va Phat trien Ha tang Vien thong,Upcom
QCG,Cong ty Co phan Quoc Cuong Gia Lai,HSX
QHD,Cong ty Co phan Que han dien Viet Duc,HNX
QHW,CTCP Nuoc khoang Quang Ninh,Upcom
QLD,Cong ty Co phan Quan ly va Xay dung giao thong Lang Son,Upcom
QLT,Cong ty Co phan Quan ly Bao tri Duong thuy noi dia so 10,Upcom
QMCGROUP,Cong ty Co phan Tap doan Quang Minh,OTC
QNC,Cong ty Co phan Xi mang va Xay dung Quang Ninh,Upcom
QNP,CTCP Cang Quy Nhon,OTC
QNS,Cong ty Co phan Duong Quang Ngai,Upcom
QNT,Trung tam Tu van xay dung thi xa Dien Ban,Upcom
QNU,Cong ty Co phan Moi truong Do thi Quang Nam,Upcom
QNW,CTCP Cap thoat nuoc va Xay dung Quang Ngai,Upcom
QPH,Cong ty Co phan Thuy dien Que Phong,Upcom
QSP,Cong ty co phan Tan Cang Quy Nhon,Upcom
QST,Cong ty Co phan Sach va Thiet bi truong hoc Quang Ninh,HNX
QTC,Cong ty Co phan Cong trinh Giao thong Van tai Quang Nam,HNX
QTP,Cong ty Co phan Nhiet dien Quang Ninh,Upcom
QVFOOD,Cong ty TNHH Kinh doanh che bien thuy san va XNK Quoc Viet,OTC
RAL,Cong ty Co phan Bong den Phich nuoc Rang Dong,HSX
RAT,CTCP Van tai va Thuong mai Duong sat,Upcom
RBC,CTCP Cong nghiep va Xuat nhap khau Cao Su,Upcom
RCC,Cong ty Co phan Tong cong ty Cong trinh duong sat,Upcom
RCD,Cong ty co phan Xay dung - Dia oc Cao su,Upcom
RCL,Cong ty Co phan Dia oc Cho Lon,HNX
RDP,Cong ty Co phan Rang Dong Holding,HSX
REDBULL,Cong ty TNHH Red Bull (Viet Nam),OTC
REDRIVER,Red River Holding,OTC
REE,Cong ty Co phan Co dien lanh,HSX
REM,Cong ty co phan Tu bo di tich Trung uong - Vinaremon,Upcom
RESCO,Tong Cong ty Dia oc Sai Gon - TNHH MTV,OTC
RGC,Cong ty co phan Dau tu PV - Inconess,Upcom
RHC,Cong ty Co phan Thuy dien Ry Ninh II,HNX
RHN,Cong ty Co phan Duong sat Ha Ninh,Upcom
RIC,Cong ty Co phan Quoc te Hoang Gia,HSX
RICONS,Cong ty Co phan Dau tu Xay dung Ricons,OTC
RLC,Cong ty Co phan Duong bo Lao Cai,Upcom
ROS,Cong ty co phan Xay dung FLC Faros,HSX
ROSE,CTCP Chung khoan Globalmind Capital,OTC
ROXY,CTCP Roxy Viet Nam,OTC
RTB,Cong ty co phan Cao su Tan Bien,Upcom
RTD,CTCP Phat trien cong nghe nong thon,OTC
RTH,Cong ty Co phan Duong sat Thanh Hoa,Upcom
RTS,CTCP Thong tin tin hieu Duong sat Da Nang,Upcom
RUBSE,Cong ty Co phan Chung khoan CAO SU,OTC
S12,Cong ty Co phan Song Da 12,Upcom
S27,Cong ty co phan Song Da 27,Upcom
S33,Cong ty co phan Mia duong 333,Upcom
S4A,Cong ty Co phan Thuy dien Se San 4A,HSX
S55,Cong ty Co phan Song Da 505,HNX
S64,Cong ty Co phan Song Da 6.04,HNX
S72,Cong ty Co phan Song Da 7.02,Upcom
S74,Cong ty Co phan Song Da 7.04,HNX
S91,Cong ty Co phan Song Da 9.01,HNX
S96,Cong ty Co phan Song Da 9.06,Upcom
S99,Cong ty Co phan SCI,HNX
SAB,Tong CTCP Bia - Ruou - Nuoc giai khat Sai Gon,HSX
SABECONT,Cong ty co phan Bia Sai Gon - Nghe Tinh,OTC
SABIBECO,Cong ty co phan Bia Sai Gon-Binh Tay,OTC
SAC,Cong ty Co phan Xep do va Dich vu Cang Sai Gon,Upcom
SADACO,CTCP Phat Trien San Xuat Thuong Mai Sai Gon,OTC
SAF,Cong ty Co phan Luong thuc Thuc pham Safoco,HNX
SAGRI,Tong Cong ty Nong nghiep Sai Gon - TNHH MTV,OTC
SAIGON5,Cong ty TNHH MTV Xay dung Thuong mai Sai Gon 5,OTC
SAIGONAM,Saigon Asset Management,OTC
SAIGONCAPITAL,Cong ty Co phan Quan ly quy Sai Gon,OTC
SAIGONCONS,Tong Cong ty Xay dung Sai Gon - TNHH MTV,OTC
SAIGONCOOP,Lien hiep Hop tac xa Thuong mai Thanh pho Ho Chi Minh,OTC
SAIGONPETRO,Cong ty TNHH MTV Dau khi Thanh pho Ho Chi Minh,OTC
SAIGONTOURIST,Tong Cong ty Du lich Sai Gon - TNHH Mot thanh vien,OTC
SAL,Cong ty Co phan Truc vot cuu ho Viet Nam,Upcom
SAM,Cong ty Co phan SAM Holdings,HSX
SAMCO,Tong Cong ty Co khi Giao thong Van tai Sai Gon - TNHH MTV,OTC
SAMVEH,Vietnam Equity Holding,OTC
SAMVPH,Vietnam Property Holding,OTC
SAP,Cong ty Co phan In Sach giao khoa tai Tp.Ho Chi Minh,Upcom
